{
  "schema_version": 1,
  "id": "ANSWERS-example",
  "status": "draft",
  "project": "example-project",
  "questionnaire": "QUESTIONNAIRE-example",
  "answers": [
    {
      "question_id": "auth-model",
      "value": true,
      "source": "user",
      "rationale": "The product has administrator and user sessions."
    }
  ],
  "unknowns": [],
  "assumptions": [],
  "content_hash": "sha256:answers-example"
}
